{
  "$defs": {
    "DeliveryResponse": {
      "properties": {
        "at": {
          "type": "string"
        },
        "channel": {
          "type": "string"
        },
        "delivered": {
          "type": "boolean"
        },
        "error": {
          "type": [
            "string",
            "null"
          ]
        }
      },
      "required": [
        "channel",
        "at",
        "delivered",
        "error"
      ],
      "type": "object"
    },
    "LastErrorResponse": {
      "properties": {
        "at": {
          "type": "string"
        },
        "message": {
          "type": "string"
        }
      },
      "required": [
        "at",
        "message"
      ],
      "type": "object"
    },
    "MissingResponse": {
      "properties": {
        "field": {
          "type": "string"
        },
        "message": {
          "type": "string"
        }
      },
      "required": [
        "field",
        "message"
      ],
      "type": "object"
    }
  },
  "$schema": "https://json-schema.org/draft/2020-12/schema",
  "properties": {
    "dropped": {
      "format": "uint",
      "minimum": 0,
      "type": "integer"
    },
    "last_delivery": {
      "anyOf": [
        {
          "$ref": "#/$defs/DeliveryResponse"
        },
        {
          "type": "null"
        }
      ]
    },
    "last_error": {
      "anyOf": [
        {
          "$ref": "#/$defs/LastErrorResponse"
        },
        {
          "type": "null"
        }
      ]
    },
    "missing": {
      "anyOf": [
        {
          "$ref": "#/$defs/MissingResponse"
        },
        {
          "type": "null"
        }
      ]
    },
    "name": {
      "type": "string"
    },
    "queued": {
      "format": "uint",
      "minimum": 0,
      "type": "integer"
    },
    "readiness": {
      "type": "string"
    },
    "settings": {
      "additionalProperties": true,
      "type": "object"
    }
  },
  "required": [
    "name",
    "readiness",
    "missing",
    "settings",
    "last_delivery",
    "last_error",
    "queued",
    "dropped"
  ],
  "title": "ChannelResponse",
  "type": "object"
}
